,category,title,body
4853,tech,what do you get?,q. what do you get when you cross a mosquito with a computer? a. a lot of bytes!!!
4854,other / misc,why was he?,q. why was the piano locked out? a. because he had no keys!
4855,one liners,who likes to?,q. who likes to make dinner for peter pan? a. captain cook!
4856,puns,what do you call?,q. what do you call a cow that gives chocolate milk? a. an utter delight!
4859,one liners,why he could not get married.,why could not the human torch get married? he could not find his match!
4860,one liners,what do you call a?,what do you call a stupid garbage can? a dumb ster!
4861,other / misc,what did the director say?,what did the director say after making the mummy movie?  it is a wrap! 
4862,other / misc,what always.....?,q. what always stays hot inside a refridgerator? a. salsa!
4865,one liners,is this joke a duplicate?,"no, of course it is not."
4867,other / misc,little red riding hood,q. what little girl takes from the rich and gives to the poor? a. little red robbin' hood!
4868,yo momma,genes...,your mama is so fat because your mama is mama passed down genes!
4869,insults,upside down!,you are so fat you turn the world upside down!
4875,blond,how do you plant dope??,how do you plant dope? bury a blond.
4877,yo momma,it's windy out here!,"yo momma is so fat, she sneezed and caused a hurricane!"
4882,one liners,rude,rudeness   someone who keeps talking while your are trying to interrupt.
4888,one liners,reading,"from a brunette is point of view  blondes may have more fun but hey, at least we can read!"
4890,religious,jesus,what do the letters  inri  at the top of jesus' cross stand for? i am nailed right in.
4894,yo momma,yo momma,who is yo momma? yo momma does not know.
4896,one liners,what is laziness?,this is laziness!
4899,news / politics,trees and bushes,to save a tree remove a bush.
4900,other / misc,sexist,what do you call a woman with one black eye? a fast learner.
4903,yo momma,stupid,yo momma so stupid she ties her shoes with spahgetti so she can eat and run.
4905,yo momma,momma,"yo momma so bald, i can read her mind"
4906,men / women,puede un hombre?,"can a mane date the sister of his widow? no, because you can not date when you are dead."
4909,one liners,dare,d.a.r.e. sadly does not stand for drugs are really excellent.
4910,yo momma,wheel,yo momma so stupid she asked to buy a vowel on wheel of fortune and said  s 
4914,animal,chicken shoes,what kind of sneakers do chickens wear? re bok bok bok bok bok.
4923,redneck,you might be a redneck if... #999058431,if you have not read this joke
4924,knock-knock,duhh!!,knock knock who is there? me duhh!!
4925,animal,why did the chicken cross the road?,"why did the chicken cross the road? i do not know, ask the chicken!"
4926,blond,a blonde and red head,what did the blonde say to the red head? nothing. she could not remember what she was going to say!
4928,insults,ugly,"your so ugly, when you were born the doctors shoved you back in."
4929,other / misc,pennies,what did one penny say to another penny? let is get together and make cents
4931,insults,super small,"you are so small that on your id picture, your feet showed."
4933,yo momma,hurricane,yo momma is so fat if they named a hurricane after her it would have to be a category 20.
4934,yo momma,yo mommas so stupid,yo mommas so stupid she asked how much she had to pay to get a free car wash.
4935,yo momma,yo mommas so stupid,"yo mommas so stupid, she brought a tv remote to the movie theater."
4936,yo momma,sooo dirty,"yo momma so dirty, she went in for a shower and lost weight!"
4943,yo momma,stink,yo mamma is so nasty that she can help stop air pollution by not breathing.
4944,other / misc,how can you tell if a man's a redneck?,"if he concentrates on the bottle because it says,  from concentrate! "
4964,one liners,privacy policy,"we rated with rsac i, tm safe surf rated."
4965,other / misc,contact us,please submit any comments you have using this form  your email address  message  send feedback
4968,yo momma,machine,yo mamas so dumb she put a quarter in a parking meter and said  hey! wheres my gumball? .
4970,animal,ba-a-a,q.what did one sheep call the other sheep who stole his food? a. a ba a astard
4971,redneck,baby stroller,you might be a redneck if your baby stroller consists of a potato sack and a wheelbarrow.
4972,yo momma,scary,"yo mama is so scary, she killed freddy krouger in his own dreams."
4974,yo momma,stripin,"yo mama is so stupid, when i told her to turn on the tv, she started stripping."
4977,blond,internship,what was the blonde college student doing at the harbor? looking for an internship.
4981,redneck,how does a redneck take a bubble bath?,q  how does a redneck take a bubble bath? a  he farts in a puddle
4983,men / women,fake orgasms,q. why do women fake orgasms? a. because they think men care!
4987,other / misc,why are scissors such good dancers?,q  why are scissors such good dancers? a  because of their sharp moves.
4994,insults,pigs fly,parent  you two should sing in the talent show together. tim  when pigs fly! cindy  you fly?
4995,other / misc,soup,q> what kind of soup do gay chinese men like? a> cream of sum yun guy
4996,one liners,free of charge,the only thing truly free of charge is a dead battery.
4997,yo momma,bad credit,"yo momma is credit is so bad,,, the bank wants the their calendar back"
5002,one liners,career choice,what can a picnic table do that a musician can not do? support a family of six!
5005,one liners,new line of...,the lazy bowl reclining toilet  it is plush while you flush!
5006,gross,jack off,"if jack helped you off your horse, later would you return the favor and help jack off his horse?"
5009,children,friends,boy  may i hold your hand? girl  it is not very heavy. i think i can carry it myself.
5020,animal,elephant on a highway,what was the elephant doing on the highway? about 5 mph
5023,yo momma,kool-aid man,"yo mama is so fat, when she put on a red sweater and went outside all the kids said  kool aid man! "
5025,yo momma,yo mama,"yo mama is so ugly, she looks like your dad."
5026,insults,teeth,"ryan is teeth were so yellow that when he walked outside, the sun said give me my butter."
5029,yo momma,so old,"yo momma is so old, i slapped her back and her tits fell off."
5030,yo momma,so fat,"your momma is so fat, she uses a matress as a tampon."
5072,blond,the smart blonde,did you hear about the smart blonde? neither did i!
5073,yo momma,fat momma,yo momma is so fat she used the grand canyon as her sidewalk.
5087,one liners,naps,"short naps prevent aging, especially if taken while driving."
5090,men / women,three two letter words,what are three two letter words for small? is it in?
5105,one liners,love,"if you love someone, set them free. if they come back, set them on fire."
5113,yo momma,fat,"yo mama is so fat, she does not need the internet   she is already world wide."
5132,yo momma,yo momma store,"yo momma so fat, when she walked into a store the beeper went of twice"
5136,knock-knock,knock on the door,knock knock who is there? doris doris who? door is shut thats why i knocked!
5153,other / misc,the brakes,why did not the brakes want to work? because it was time for their lunch break.
5166,yo momma,hurricane 2,"yo momma is so fat, when she walks she creates hurricanes."
5170,puns,melon,why did the melon jump into the water? because it wanted to be a watermelon!
5173,one liners,the cliff,why did the penny jump off the cliff and not the quarter? because the quarter had more cents!
5179,children,root beer,"johnny   dad, stop drinking my root beer!!! do i get free refills?  dad   sure    i backwashed! "
5180,one liners,pickup lines,is that a mirror in your jeans? because i can see myself in them.
5185,gross,tasteless,what do starving ethiopians and yoko ono have in common? they are both living off dead beatles.
5192,other / misc,mums the word,what do you call a mouth without any teeth?  grandma
5195,men / women,chances of a man winning an argument,"chances of a man winning an argument  dating  50  engagement  25  marriage period  0 , very rare"
5196,puns,clinton,most people worry about getting aids from sex. bill clinton worries about getting sex from aides.
5197,puns,clinton2,did you hear bill clinton gave up playing his sax a phone? he now plays his whore monica.
5198,puns,clinton 3,why does clinton wants a postage stamp issued in his image? so he gets licked more often.
5200,puns,more clinton,what is the new name for the place where bill clinton does his business? the oral office.
5201,puns,more clinton,what does monica lewinsky have on her resume?  sat on the presidential staff 
5203,puns,more clinton 2,what is bill clinton is favorite movie ? sex lies and video tape
5204,news / politics,more clinton 3,what is bill is definition of safe sex? when hillary is out of town.
5205,puns,still more clinton,how does clinton divert his attention from the latest controversy? he just keeps on plugging away.
5206,one liners,what goes...,q. what goes clop... clop... clop... bang! clop clop clop clop clop clop? a. an amish driveby
5207,blond,blond,"why is a blond, blond? is not it obvious? they are dumb."
5209,one liners,moldy,"this joke is so old, it has mold on it! ha ha ha!"
5211,lawyer,not all bad,not all lawyers are bad. i have seen some graveyards full of good ones!
5212,animal,kangakes,what is a kangaroo is favorite restaurant? ihop!
5219,other / misc,thongs,"i hate thongs! i mean, come on, women do not need to floss their butts."
5220,one liners,war,"war not determine who right, war determine who left."
5221,men / women,guess who!!,what is the name of a naked woman lying between two naked men? sharin peters
5222,knock-knock,stew,"knock knock who is there? stew stew who? stew cold out here, let me in!"
5223,other / misc,"funny, sorta","if i lost a dollar for every brain you have, i would be in debt"
5224,animal,eat with ears,"which animals eat with their ears? all of them, since no animal takes its ears off to eat!"
5228,insults,how to keep an idiot busy for hours,here is a link to the joke http   miamistreetracing.com forum v...d.php?tid 2385
5236,one liners,ford stands for...,found on roadside dead fucked over re built dodge
5237,yo momma,yo momma jokes are stupid,"yo momma jokes are so stupid, i barf everytime i see one!"
5247,one liners,photographers,"old photographers never die, they just go out of focus!"
5250,blond,amusement park ride,why did not the blonde go on the amusement park ride? because he was too tall.
5256,knock-knock,warm welcome,knock knock go away!!! we do not want any!!!
5257,insults,don't feel bad...,"do not think of yourself as an ugly person, think of yourself as a really pretty monkey."
5259,men / women,breast,what is the quickest way to a woman is heart? through her left breast.
5261,other / misc,sit sleep and brush,"what can you sit on, sleep on, and brush your teeth with? a chair, a bed, and a toothbrush!"
5263,animal,polar bear,q  what is a polar bear is favorite cereal? a  ice krispies
5264,other / misc,pick up lines,are you a parking ticket? cause you got fine written all over you!!!
5266,lawyer,the circus of congress,what do a circus and congress have in common? they are both full of clowns
5267,yo momma,ma vs mj,"yo momma so scary, she scares michael jackson!"
5268,one liners,shark,what is the best way to talk to a shark? long distance!
5275,yo momma,your mom has crabs!!!,yo mama is so nasty she is got to pour sand down her pants to keep the crabs happy!
5276,news / politics,oops!,"what did dick cheney say before he shot his hunting companion? ready, fire, aim!"
5277,men / women,what do you....,"what do you call an intelligent, good looking man? a  a rumor!"
5278,men / women,what do you call.....,q  what do you call a handcuffed man? a  trustworthy
5279,knock-knock,ice cream,knock knock? who is there? ice cream. ice cream who? i scream for ice cream!!
5280,other / misc,spiders,q  where do spiders go to learn new words? a  web sters dictionary!!
5281,one liners,poor dog,why did the poor dog chase his tail? he was trying to make ends meet!
5283,yo momma,verizon hired-less,yo momma is like a cell phone  free on nights and weekends!
5284,yo momma,shot gun,yo mamma is like a shot gun  one cock and shes ready to blow!!
5285,news / politics,bush,george bush to friend  sorry i forgot your birthday. dick cheney forgot to put it on my to do list.
5286,insults,public toilets,"boys are like public toilets  they are either taken, or full of crap.  no offense to you boys "
5295,yo momma,dumb,yo momma is so dumb when she got locked in the matress king she slept on the floor
5297,insults,yo daddy,"your daddies so old, i slapped his butt and his balls fell off"
5298,insults,latino joke against white people,say it really fast say pink cheese green ghost  fast if ur a true latino youll get wat this means
5299,insults,basket ball,"why are black people so good at basket ball? because they can run, shoot and steal."
5300,yo momma,yo momma,yo momma is so fat she uses a rocket ship as a dildo.
5301,redneck,#1 redneck,you might be redneck if you have totaled every car you have owned.
5302,redneck,#2 redneck,you might be a redneck if you answer to more than one nickname.
5303,redneck,#3 redneck,you might be a redneck if you have orange road cones in your living room!
5304,redneck,#4 redneck,you might be a redneck if your toenail clippers say craftsman on the side!
5305,redneck,#6 redneck,you might be a redneck if you have never stayed in a hotel without stealing something
5306,redneck,#7 redneck,you might be a redneck if you have ever videotaped a dog loving on someone is leg.
5311,animal,why did the squirrel cross the road,why did the squirrel cross the road? because it was nuts!!!!!!!!!!!!!
5316,other / misc,what amimal,what amimal walks with its feet on its head? a flea.
5317,animal,rooster,why did the rooster cross the road? to fuck the chicken.
5318,animal,elephant,why did the elephant cross the road? because the chiken retired.
5319,yo momma,couch,"yo momma is so stupid, she sat on the tv and watched the couch."
5322,puns,tigger,why does tigger smell so bad? cause he is always hanging out with pooh.
5326,other / misc,golfing,why does a man wear two pairs of pants when he goes golfing? he might get a hole in one!
5328,insults,diapers,boys are like diapers.... always on my ass and full of shit.
5331,animal,foxxxy,once i like bought a fox and i like named him jorge and like he died and i cried so i bought shoes.
5339,yo momma,godzila,when your mom whent to china people would say  run it is godzilla! 
5340,yo momma,lost,yo momma is so fat when she hugs people they get lost!
5341,insults,cream filling,q  what do you say when you see a group full of black people? a  where is the cream filling?
5342,insults,yard sales,why do alot of people go to black peoples yard sales? a to get there stuff back.
5343,yo momma,bathroom,yo momma is so stupid she got locked up in the bathroom and she peed in her pants!!
5344,yo momma,yo momma's so fat...,"yo momma is so fat, when she went in a hot air balloon there was a solar eclipse!"
5346,redneck,#9 redneck,you know you are a redneck if your fence doubles as your clothesline
5347,redneck,#10 redneck,you know you are a redneck if you have season tickets for the tractor pull.
5349,redneck,#12 redneck,you know you are a redneck if a city night on the town includes city jail.
5350,redneck,#13 redneck,you know you are a redneck if your bathroom towels are also your bathroom curtains.
5351,redneck,#14 redneck,you may be a redneck if your burglar alarm is a vacuum cleaner plugged into a motion detector.
5352,redneck,#15 redneck,you might be a redneck if you have ever watched a tornado from a lawn chair.
5353,redneck,#16 redneck,you know you are a redneck if you paint your garage with a paintball gun.
5354,redneck,#17 redneck,you might be a redneck if you have ever been fired for shooting spitballs.
5362,gross,nuts,what do you call a black guy and a white guy having sex? mixed nuts.
5363,gross,lemonade,what do you call a nun is urine? virgin lemonade
5365,yo momma,sun,"yo momma is so fat, she makes the sun look like a pebble!"
5366,yo momma,burp,"yo momma is so nasty, when she burped she started a nuclear war!"
5368,puns,opera singers and sailors,how are opera singers and sailors alike? they both have to handle the high seas cs !
5380,yo momma,bath tub,"yo momma so fat, she filled up the tub before she put the water in it."
5396,other / misc,walls,q  what device lets you see through a wall? a  window
5399,yo momma,so fat,"yo momma is so fat, when she wore a blue rain coat people said,  let is go swim in the ocean! "
5400,redneck,floorbuffer,you might be a redneck if you ride the electric floorbuffer and mistake it for your wife!!
5402,redneck,tube top,you might be a redneck if you wear a tube top to a funeral!
5403,men / women,hot guys,"you might think that some guys are hot. their boyfriends think that, too!"
5409,other / misc,chuck norris facts: 21,chuck norris is.... ...stupid.
5410,animal,polar bear,q  what do you call an arctic animal shaped like a tooth? a  a molar bear!
5432,news / politics,viagra,what happens when you give a politician viagra? he gets taller.
5434,puns,scone,what happens to a scone when you have eaten it? it is scone.
5435,yo momma,test day,yo momma is so dumb she studied for a urine test!!
5436,yo momma,yo momma so ugly,"yo momma is so ugly, yo daddy had eye surgery to remove his sight!"
5445,redneck,how to confuse a redneck,how do you confuse a redneck ask him a question that is not about nascar.
5469,animal,french dog,why did the french dog look in the toilet? wee wee
5470,redneck,you might be a redneck if...,you might be a redneck if you take your family to k mart to see a movie.
5482,puns,scientist,what do scientists use to freshen their breath? experi mints
5483,puns,dinosaur,what do you call a dinosaur that smashes everything in its path? tyrannosaurus wrecks
5484,redneck,redneck joke,you might be a redneck if your kids are named after the car they were made in.
5486,puns,3 legged dog,"one day a three legged dog walked into a bar. he said,  i am looking for the guy that shot my paw. "
5498,yo momma,title,"yo momma is like a radio station, everyone can turn her on."
5499,puns,animal crossing,what do you get if you cross a rhino and and elephant? elepf ino  pronounced  hell if i know  
5510,redneck,redneck joke 2,you might be a redneck if your limo at your wedding was a tractor and trailer.
5511,redneck,redneck joke 3,you might be a redneck if your honeymoon was at the family farm.
5512,puns,weird words,the king had a powerful army. he reined for 7 years before clearing the clouds!!!
5513,one liners,my computer,"my computer is so old, it has a vhs slot instead of a cd dvd slot!!!"
5517,one liners,which is it?,how can you tell the difference between a violin and a fiddle? look at the audience!
5531,men / women,the guy!,once there was a guy who liked cheese.
5532,one liners,hippo,i like hippos 'cause they are fat and do not care what other hippos think.
5534,blond,dumb,blonds are so dumb. i am lucky my hair is yellow.
5535,yo momma,peanutt butter,"yo momma is so fat, she stepped on a peanut and she made peanut butter."
5536,yo momma,stupid,"yo momma is so stupid, she is stupid."
5550,one liners,did you here?,did you here about the giant with a nosebleed? it was all over town
5553,redneck,you might be a redneck,you might be a redneck if your dog is in your bed more than your wife.
5554,knock-knock,haha,"knock knock who is there? kook kook who? hey, who you calling cukoo mister?"
5555,one liners,crowing cock,why does a cock always close his eyes when he is crowing? because he already knows the text!!
5556,tech,einstein and newton,what is the similarity between einstein and newton? neither of them ever had a mobile phone!
5557,animal,stink pigs,why do pigs stink? because they have four armpits..
5558,at work,unpushed door,"what door cannot be pushed, even by 10 people simultaneously? the door that says  pull"
5563,redneck,you might be a redneck if...,you fart and you are proud of the smell
5565,yo momma,yo momma,yo momma is so uncoordinated she could not hit water if she fell out of a boat.
5566,yo momma,yo momma's so fat....,yo mommas is so fat it takes a twinky and a tub of butter to get her through the door.
5568,animal,sparky,q  what do you call a dog with no hind legs and metal balls? a  sparky!
5572,animal,watch out for that snake,what do snakes use for birth control? an anacondom!
5573,one liners,pick up lines #2,boy  is your dad a baker? girl  no. why? boy  cause you are a cutie pie!!
5574,yo momma,the bus,"yo momma is just like a bus. they are big, smelly, and you can ride it for a buck."
5585,yo momma,fat,"yo momma is so fat, her blood type is rocky road."
5589,other / misc,procrastinators,procrastinators meeting tomorrow.
5590,yo momma,mama,"yo mamma is so fat, when she went to the zoo elephants called her mom."
5591,at work,wtf???,a guy goes to work and kills everyone...what is this called...? going postal...
5595,one liners,pick up lines,"is your dad a baker? because those buns are lookin' good! i lost my phone number, can i have yours?"
5609,knock-knock,irish,knock knock! who is there? irish! irish who? irish i could think of a better joke!
5613,redneck,you might be a redneck if...,you might be a redneck if you have ever bought a birthday present out of a vending machine.
5615,redneck,you know you're a redneck if 1.,you are a legal heir to a fireworks stand.
5616,redneck,you know you're a redneck if 2,local cops know you by your nickname.
5617,redneck,you know you're a redneck if 3,you get homesick watching cops on tv.
5619,redneck,you know you're a redneck if 4,"your parrot can say,  open up, it is the police! "
5620,redneck,you know your a redneck if 5,you used a cheat sheet during your hunter is safety test.
5621,redneck,you know you're a redneck if 5,your current wife was a bridesmaid at your first wedding.
5630,insults,make up,"as an insult you could say  you know, most of you weight comes from all that make up your wearing! "
5634,animal,dog,i sprayed my dog with spot remover. now he is gone.
5656,medical,nipples,"q   why do women have nipples? a   because, if they did not, boobs would be pointless"
5660,yo momma,global warming,yo momma is so fat she farted and caused global warming
5661,redneck,you might be a redneck if...2,you might be a redneck if for your prom you wore a strapless dress but wore a bra that was not.
5669,men / women,do you love me?,"once i asked a guy,   do you love me, or is that a banana in your pocket? "
5670,redneck,you might be a redneck if...3,you might be a redneck if you think cauliflower is a phone dating service for flowers.
5674,knock-knock,king...,"knock,knock! who is there? king! king who? king kong is now part of china."
5675,other / misc,circles,why is a circle so hot???? because it is 360 degrees!!!
5677,medical,does it hurt?,"doctor   does it hurt when you do this?  patient   yes  doctor   well, you should not do it then. "
5678,knock-knock,a chu,knock knock! who is there? a chu. a chu who? bless you!
5679,animal,giraffe,why was not the giraffe invited to the party? he was a pain in the neck to talk to.
5683,redneck,another redneck joke,if you name your kids after dead family pets you just might be a redneck!
5686,news / politics,30 seconds,it is amazing how politicians can fit all their good points in a 30 second tv commercial.
5688,one liners,america,only in america can a poor black boy turn into a rich white woman...  michael jackson 
5689,one liners,america #2,only in america can a president have relations in the oral office
5690,redneck,yet another redneck joke,if you met your wife on a hunting trip you just might be a redneck.
5693,yo momma,funny,"yo momma is so poor, that when i went to her house, a roach tripped me and a rat took my wallet."
5701,redneck,still yet another redneck joke,if you have more pets than relatives you just might be a redneck.
5704,men / women,men driving,why do men pick their noses while driving? because their butts are too hard to reach!
5713,one liners,mary's little lamb,mary had a little lamb! the doctor fainted!
5714,children,best thing,q  whats the best thing about children? a  making them!!
5716,yo momma,yo momma,"yo momma is so old, that she cooked the last supper!"
5717,yo momma,ugly,yo momma is so ugly that even ripley is could not believe it!
5718,knock-knock,you!,knock knock. who is there? you! you who? what are you so happy about?
5720,one liners,like i said before..,"like i said before, i never repeat myself."
5722,other / misc,friend,i am so bad my imaginary friend left me.
5723,animal,gum,why did the piece of gum cross the road? because it was stuck to the chicken is foot!
5724,other / misc,do you know why ... in iraq,do you know why there are no wal marts in iraq? because there are so many targets.
5729,blond,good jokes,good joke  a blonde. better joke  a blonde playing chess. best joke  the blonde wins the game.
5730,blond,oh i'm gonna slip again,"q  what did the blonde say after seeing the banana on the ground? a  oh, i am gonna slip again!!"
5732,redneck,you might be a redneck if...,you have ever called the towtruck on yourself because you could not afford gas.
5733,other / misc,amanda,"what 3 words are in the name amanda? a, man, duh!!"
5734,redneck,you might be a redneck if...5,you might be a redneck if you wore a jumper to your prom.
5735,redneck,you might be a redneck if...6,you might be a redneck if your swimsuit is your bra and underwear.
5738,blond,umm,umm...why is this category called  blond  when really it is spelled  blonde ??
5740,other / misc,what is it?,"q  what is orange, red, and lies in the grass? a  a wounded cheesie!"
5741,animal,ants,why was the baby ant afraid of his uncles? because his uncles were all ants!
5745,gross,german poo,how do you say constipated in german? farfrompoopin
