,category,title,body
0,animal,cow with no legs,what do you call a cow with no legs? ground beef!
1,animal,jumping cow,what do you call a cow jumping over a barbed wire fence? utter destruction.
2,other / misc,"black, white and red",what is black and white and red all over? a newspaper.
3,bar,guy in a bar,"so, this guy walks into a bar. and says,  ouch ."
4,one liners,progress,"if the opposite of pro is con, is not the opposite of progress, congress?"
5,other / misc,guy with no limbs,what do you call a guy with no arms or legs floating in the ocean? bob!
7,bar,into the bar,there is this dyslexic guy... he walked into a bra...
11,lawyer,500 lawyers,what do you call 500 lawyers at the bottom of the sea? a start.
15,one liners,infants vs adults,do infants enjoy infancy as much as adults enjoy adultery?
16,one liners,pig,"if a pig loses its voice, is it disgruntled?"
20,blond,clever blond,what do you call a blond with half a brain? gifted.
21,gross,two legs,"q what has two legs, and bleeds? a half a dog!"
24,yo momma,pepsi challenge,"yo momma is so stupid, she took the pepsi challenge and chose jif."
37,blond,dating blonde,how can you tell if a blonde woman has been dating? by the belt buckle imprint on her forehead.
38,blond,blonde deflowering,what does a blonde say when she loses her virginity?  so are you guys all on the same team? 
39,lawyer,shingles,how many lawyers does it take to shingle the roof of a house? it depends on how thin you slice 'em.
42,animal,termit,"a termite walks into a bar and asks,  is the bartender here? "
43,puns,diarhea,"did you know diarhea is part of your inheritence? ya, it flows in our genes."
48,one liners,bayl,"when cryptography is outlawed, bayl bhgynjf jvyy unir cevinpl"
62,one liners,two guys,two guys walked into a bar... you would have thought the second one would have ducked.
64,animal,concrete wall,two fish swim into a concrete wall. one turns to the other and says  dam .
67,one liners,always remember,"remember, no one is listening until you fart."
68,one liners,if at first...,if at first you do not succeed ... avoid skydiving.
72,one liners,point of note,never play leapfrog with a unicorn.
74,yo momma,bald,"your momma is so ugly, she is not bald, it is her hair running away from her face!"
76,insults,gap,"the gap between your teeth is so big, i do not know whether to smile back or kick a field goal."
77,insults,sleep,"you are so stupid, you took a ruler with you to bed to see how long you slept!"
78,yo momma,toenails,"yo mama is so big, she had to call sherwin williams to paint her toenails!"
80,insults,around the house,"you are so fat, when you sit around the house, you really sit around the house."
82,redneck,thirty-two rednecks,what do you call 32 rednecks in a room? a full set of teeth!
123,knock-knock,interrupting cow,knock knock. who is there? interrupting cow interrupting co    moo
124,yo momma,so ugly,yo momma so ugly she went into a haunted house and came out with a job application.
125,yo momma,so stupid,yo momma so stupid she got hit by a parked car.
126,yo momma,ugly contest,"yo momma is so ugly, when she joined an ugly contest, they said  sorry, no professionals... "
128,yo momma,break and enter,"yo mama is so ugly, two guys broke into her apt., she yelled  rape , they yelled  no! "
130,yo momma,halloween,"your momma is so ugly, the government moved halloween to her birthday."
134,blond,closet,what do you call the skeleton of a blonde you find in a closet? 1950 is hide n seek champion.
137,blond,ice cubes,why should you never ask a blonde to make ice cubes for you? she will never remember the recipe.
144,blond,computer,how do you tell a blondes been using your computer? there is whiteout on the screen
147,insults,indecent,you are so ugly when you go outside your arrested for indecent exposure.
149,lightbulb,light bulb,how many surrealists does it take to change a light bulb? fish!
152,other / misc,boy scouts,how many boy scouts does it take to screw in a lightbulb? three  each to do one good turn daily.
153,yo momma,so fat,"yo mama is so fat, she did not have a birth certificate, she had a blueprint!"
154,yo momma,shade,"yo mama is so fat, she sells shade, and that gives her enough to feed a family!"
155,yo momma,so poor,"yo momma is so poor, i blew my nose, and she said,  lord thank us, we have food! "
165,tech,computer vs. air conditioner,how is a computer like an air conditioner? when you open windows it will not work!
172,gross,bravery,what is the definition of bravery? a man with diarrhea chancing a fart!
173,blond,santa,how does santa greet the three blonde sisters? ho. ho. ho.
174,insults,birth control,you were so ugly as a baby you were the poster child on the birth control posters.
176,other / misc,new york,why are new yorkers always depressed? because the light at the end of the tunnel is new jersey.
178,yo momma,football,yo mama is so dumb she took a spoon to the superbowl!
179,yo momma,long time,"yo mama is so stupid, it takes her two hours to watch 60 minutes!"
187,knock-knock,duh...,knock knock. who is there? someone too short to ring the doorbell.
189,puns,two buzzards...,"two buzzards were eating a dead clown. one said to the other,  does this taste funny to you? "
190,yo momma,yo mama,"yo mama is so dumb, she had you."
192,one liners,atm,why do they have braille on drive thru atms?
193,one liners,women,can women put mascara on with their mouth closed?
195,one liners,depression,depression is merely anger without enthusiasm.
196,one liners,birds,"the early bird may get the worm, but the second mouse gets the cheese."
197,one liners,eagles,"eagles may soar, but weasels do not get sucked into jet engines."
198,one liners,cholesterol,i drive way too fast to worry about my cholesterol.
199,one liners,success,"success is relative. the more success, the more relatives!"
200,one liners,freeway,"when everything is coming your way, you are on the wrong side of the freeway."
204,other / misc,daffynition,"antique an item your grandparents bought, your parents got rid of, and you are buying again."
206,one liners,good way,a good way to save face is to keep the lower half shut.
207,one liners,golden,"silence is golden, because you never have to explain something you did not say."
208,one liners,insomnia,"i am such an insomniac, the sheep fall asleep before i do."
209,yo momma,so fat,"yo mama is so fat, when she walks by the television set you miss three episodes."
210,other / misc,i know,i know the day i gave up exercise. you wanna know? check my birth certificate.
211,yo mama,she so fat,yo mamma so fat when she wears high heels 2 hours later they are flip flops.
212,yo momma,nintendo,your mom is so fat she rolled over a supernintendo and made 4 game boys.
213,yo momma,pictures,your mom is so fat her picture fell down.
214,yo momma,tan,"your mom is so fat, she is the only one at the beach that gets a tan."
215,yo momma,pillows,"yo momma is so fat she had a dream of marshmallows, and when she woke up, her pillows were gone."
218,yo momma,graveyard,your momma so ugly when she walked through the graveyard 2 men came after her with shovels.
219,yo mama,skittles,yo mama so fat when she sat on a rainbow skittles came out!
220,yo momma,gravy,your momma so fat when she broke a leg gravy came out.
221,yo momma,the track,your momma so ugly when she went to the horse track people started placing bets on her.
235,yo momma,yo mama*2,yo mama is so fat that the local restaurant says  maximum occupancy 115 people or yo mama.
236,yo momma,milk carton,yo mama is so fat that when she ran away they had to use all four sides of the milk carton.
237,yo momma,yo mama*3,"yo mama is so ugly, when she looks in the mirror her reflection ducks."
240,other / misc,boomerang,what do you call a boomerang that does not work? a stick.
241,animal,horse,"a horse walked into a bar. the barman said,  why the long face? "
247,knock-knock,dwayne,"knock, knock. who is there? dwayne dwayne who? dwayne the bathtub mommy, i am dwowning."
248,yo momma,tv's,"yo dad said to yo mama,  we are getting a color tv!  and yo mama asked,  what color? "
250,yo momma,driver,yo mama is so stupid she waited at a stop sign until it said go.
251,yo momma,glass,"yo mama is so stupid, she climbed over a glass wall to see the other side."
252,yo momma,restaurants,yo mama is so stupid she stole a free sample.
253,yo momma,blood,yo mama is so stupid she could not even pass a blood test.
254,yo momma,lol,yo mama is so stupid she thinks these jokes are funny.
255,yo momma,weight,"yo momma is so stupid, she got locked in mcdonalds, and lost 300 pounds."
257,yo momma,yo momma,"yo momma is so stupid, she put a free sample on layaway."
258,yo momma,doorway,"yo mama is so poor that when i walked in the front door, i tripped over the back gate."
259,other / misc,actual headline,an actual headline   include your children when baking cookies 
260,other / misc,actual headline#2,an actual headline   police begin campaign to run down jaywalkers 
261,other / misc,headline#3,an actual headline  safety experts say school bus passengers should be belted.
262,other / misc,headline#4,"an actual headline  deer kill 17,000"
265,animal,charging rhino,how do you keep a rhino from charging? take away its credit card.
270,other / misc,psychic,what do you call a short psychic on the lam? ~~~~~~~~~~~~~~~~~~~~~ a small medium at large!
271,puns,computer,how do you praise a computer? say  data boy !
287,lawyer,sharks,q  why will not sharks attack lawyers? a  professional courtesy.
288,lawyer,buried,q  what do you have when a lawyer is buried up to his neck in sand? a  not enough sand.
289,lawyer,geese and ducks,"q  what can a goose do, a duck can not, and a lawyer should? a  stick his bill up his rear."
291,knock-knock,boo!,knock knock who is there? boo! boo who? do not cry it is just a joke
292,lightbulb,mice,how many mice does it take to screw in a light bulb? two  think about it 
299,medical,roses are red,roses are red violets are blue i am schizophrenic and so am i!
302,yo momma,so fat...,"yo mama is so fat, she went to buy a water bed and they put a blanket over the altantic ocean."
319,blond,square,why are the blonde is boobs square? she forgot to take the tissues out of the box!
323,blond,braincells,how do a blond is braincells die? alone.
326,one liners,sword,those who live by the sword get shot by those who do not.
331,yo momma,yo momma,yo momma is so dumb that when she got locked in the grocery store she starved to death!
332,yo momma,duh,yo mama stinks so bad that when she puts on her  isecret' deodorant it tells! ha ha   
356,insults,faces," i never forget a face. however, in your case, i will be glad to make an exception.   groucho marx"
361,lawyer,honest lawyer,what do you call an honest lawyer? an oxymoron.
370,other / misc,lone bones,q  why did not the skeleton go to the dance? a  because it had no body to go with.
371,animal,"fish says, ""duuuuude!""",q  what does a fish use to get high? a  seaweed!
389,one liners,complaining wife,my wife keeps complaining i never listen to her...or something like that.
394,insults,perfect idiot,"people say you are the perfect idiot. i say you are not perfect, but you are doing pretty good."
408,one liners,stealing,do not steal. the government hates competition.
410,men / women,government vs. men,what is the difference between men and government bonds? the bonds mature. eventually.
412,one liners,abbr.,why is the word abbreviation so long?
415,one liners,cross-country,"if you are going to try cross country skiing, start with a small country."
416,one liners,i don't exercise...,i do not exercise because it makes the ice jump right out of my glass.
449,sports,hockey,what do you call a canadian fire? a calgary flame.
450,other / misc,bill clinton,what does monica lewinski and a coin machine have in common? insert bill here!
473,blond,fish,q. why do young blondes carry goldfish in their pockets? a. so they can smell like old blondes.
484,blond,steering wheel,what do you call a blonde behind a steering wheel? an air bag
488,one liners,lawyers creed,lawyers creed  a man is innocent until proven broke.
499,one liners,egyptologist,the egyptologist sneezed  hapshepsut!
500,one liners,fat chance,ever notice that  fat chance  and  slim chance  mean the same thing?
501,one liners,how to calculate the cost of living,take your income and add 10 
507,one liners,solutions,every solution breeds new problems.
508,other / misc,marines,"join the marines  visit exotic places, meet interesting people and then kill them."
511,men / women,miss right,i married miss right. i just did not know her first name was always.
512,blond,smile!,why does a blonde smile at lightning? she thinks she is getting her picture taken.
520,blond,blow in the ear,what does a blonde say when you blow in their ear? thank you for the refill.
522,lightbulb,republicans,"how many republicans does it take to screw in a lightbulb? none, they only screw the poor."
523,lightbulb,blondes,"how many blondes does it take to screw in a lighbulb? none, they just assume they have gone blind."
531,one liners,maternity ward,sign seen on a maternity ward door  push! push! push!
542,one liners,someone, all my life i wanted to be someone  i guess i should have been more specific.   jane wagner
544,insults,round room,how do you confuse a stupid person? put them in a round room and tell them to sit in the corner.
545,blond,kool-aid,why do blondes hate making kool aid? they can not fit the 8 cups of water in the envelope!
547,yo momma,90210,yo momma is so fat that the last time she saw 90210 is when she stepped on the bathroom scale!
555,gross,yuck!," mommy, i hate my sister is guts!   shut up and eat what is put in front of you! "
556,one liners,model,then there was the model who sat on a broken bottle and cut a good figure.
559,one liners,neat nurse,"then there was the neat nurse, who made the patient without disturbing the bed."
560,one liners,three bears,then there were the three bears. one married a giraffe. the other two put him up to it.
561,puns,mind over matter,"mind over matter if you do not mind, it does not matter."
562,one liners,complex," madame,  said the psychiatrist,  you have not got a complex  you are inferior. "
567,puns,pirate movie,did you see that movie about the pirate? it is rated arrr!
568,yo momma,toiletry,"yo momma is so fat, it takes 2 toilets to fit one cheek!"
569,yo momma,a belt?,your mama so fat that she has to wear traintracks for a belt!
570,yo momma,mt. rushmore,your mama so old and fat that she went to see mt. rushmore and sang  we are family 
571,yo momma,walking,your mama so big that people walk around her for exercise.
586,yo momma,saturns rings,yo mama is so fat she used saturn is rings as hoola hoops!
587,blond,motorcycle,what are two blondes doing in front of a motorcycle? arguing about who get a window seat.
588,blond,smart blond?,what do you call a smart blond? an endangered species
589,blond,mission impossible,what do you call a movie about a man trying to make a blond smart? mission impossible
591,blond,chain link fence,why do blondes climb chain link fences? to see what is on the other side.
592,blond,tight skirt,why does a blond wear a tight skirt? to keep her legs closed
594,blond,intelligent blonde?,what do you call an intelligent blonde? a golden retriever
596,lightbulb,dyslexics,how many dyslexics does it take to change a lit blub?
602,yo momma,popcorn,"yo mama so fat, she coughed next to a corn field and made popcorn."
609,other / misc,wall to wall,what did the wall say to the picture? how is it hangin`?
611,one liners,gas,i wonder who came up with the company people is gas and where was their pepto bismal?
613,puns,california,what happens when the smog clears over southern california? ucla
616,insults,roses are red,"roses are red, violets are blue, i thought i was stupid, then i met you!"
622,one liners,old-fashioned way,i make money the old fashioned way. my salary is the same as it was ten years ago.
626,one liners,headline,actual newspaper headline  kids make great snacks for teachers.
637,other / misc,blind sky diving,why do not blind people sky dive? because it scares the crap outta the dog.
638,gross,mathematician,what do constipated mathematicians do? work it out with a pencil.
639,yo momma,so ugly,yo mama is so ugly not even the tide would take her out.
643,one liners,zen,what did the zen buddhist say to the new york hot dog vendor?  make me one with everything. 
660,men / women,toilet paper,"how many men does it take to change a roll of toilet paper? we do not know, it has never happened."
666,sports,endless love,what is the definition of endless love? stevie wonder playing ray charles at tennis! endless love!
679,yo momma,on the scale,"yo mama is so fat when she steps on a scale, it reads  one at a time, please !"
680,men / women,life,"contrary to popular opinion, life is not a bi  h. life is a virgin. a bi  h would be easy."
681,one liners,enzymes and hormones,what is the difference between an enzyme and a hormone? you can not hear an enzyme!
684,animal,cows night out,q  where do cows go on saturday nights? a  to the moovies
690,blond,911,why can not you trust a blonde to call for an ambulance? she can not find the 11 to call 911.
691,yo momma,baldie,yo momma is so bald when she wears a turtleneck she looks like a broken condom.
692,yo momma,beaver,yo momma so fat when she stepped on my dog is tail i had to change his name to  beaver. 
694,blond,welfare blonde,why did the blonde call the welfare office? she wanted to know how you cook food stamps.
696,one liners,tired?,the amount of sleep required by the average person is about five minutes more.
699,one liners,perfect climate,the perfect climate is in bed.
700,blond,oximoron,q  what do you call an oxymoron? a  a smart blonde!
701,puns,dirty joke,wanna hear a dirty joke? a boy fell in a mud puddle.
718,yo momma,shower,yo mama so skinny she had to run arround the shower to get wet.
719,at work,make a long story short,"to make a long story short, well, it helps if the boss walks in!"
721,men / women,dope,grow some dope... plant a man.
729,other / misc,definition of an alarm clock,"alarm clock, n. a device for waking up people who do not have small children"
737,yo momma,dumb,"yo mama so dumb, she tried to spell out the alphabet with m m is."
743,one liners,opera,"opera  where somebody gets stabbed in the back and, instead of bleeding, sings."
748,blond,pregnant,what two things in the air can make a blonde pregnant? her legs
750,medical,good egg,whats the difference between a good egg and a good fart? you can not beat a good fart!
751,one liners,hookers,blind hookers eh? you have got to hand it to them.
758,men / women,3 rings,"there are three well known rings to marriage  engagement ring, wedding ring, and suffering!"
759,yo momma,humpty dumpty,"yo mama is like humpty dumpty.... first she gets humped, then she gets dumped!"
760,one liners,bad driver,"if you do not like my driving, stay out of the bus shelters!"
767,other / misc,m. j.,how does michael jackson pick his nose? through a catalogue!!
768,puns,tequila,did you hear about the woman who poured margaritas in her birdbath? enough tequila mockingbird.
770,knock-knock,chips,knock knock! who is there? chips. chips who? chips ahoy!
772,blond,how to kill a blond,q. how do you kill a blond? a. put a scratch and sniff sticker at the bottom of a pool.
773,yo momma,so fat,"yo mama is so fat, when she got on the scale it said to be continued!"
774,yo momma,dirty,yo momma so dirty she has to sneak up on the water
775,yo momma,pms,"your momma such a bitch, pms cheers her up."
776,yo momma,yo mama,"yo mama is so fat, when she stepped on the scale she screwed it to the bottom of the floor."
779,one liners,tips on pill taking,never ever take a sleeping pill and a laxative in the same night.
785,yo momma,411,yo momma is so dumb she had to call 411 to get the number for 911.
786,yo momma,clear,"yo mama so dumb, her favorite color is clear."
788,blond,keeping a blonde busy,how do you keep a blonde busy?  see below  how do you keep a blonde busy?  see above 
792,lightbulb,how many paranoids?,how many paranoids does it take to screw in a lightbulb? what exactly do you mean by that?
794,lawyer,copperwire,how was copper wire invented? two lawyers were fighting over a penny.
804,one liners,ghosts,why do not ghosts make good magicians? you can see right through them!
805,medical,"doctor, doctor:...","patient  doctor doctor, j keep seeing doubles! doctor  please take a seat. patient  which one?"
807,other / misc,cappuccino buzz,i had four cappuccinos at one time. i was bouncing off the walls. good thing they were padded.
810,lightbulb,existentialists,how many existentialists does it take to change a light bulb? what light bulb?
811,yo momma,pirates see her,"yo momma is so big that when pirates see her they say,  land ho! "
813,yo momma,playstation,"yo mama is so dumb, she thought that a playstation was a day care place."
814,knock-knock,madam,knock knock who is there? madam madam who? madam foot is caught in the door!
815,yo momma,bungee jumping,"yo mama is so fat that when she went bungee jumping, she took down the whole bridge with her."
816,yo momma,fun fun fun,yo mama is so fat that she rents herself out as a jumping castle.
818,knock-knock,july,knock knock who is there? july july who? july like bill clinton
822,news / politics,coast gaurd bumper sticker,this is off a coast guard bumper sticker  support search and rescue  get lost!
824,tech,metric system,"darn those pushy metric system advocates! give them 2.54 cm., and they will take 1.6093 km!"
829,yo momma,mt. mama,"yo mama is so fat, her inuit name is denali!"
830,yo momma,gamecube,"yo momma is so dumb, she thought a gamecube was a rubik is puzzle."
831,yo momma,tsunami mommy,"yo momma is so fat, when she jumps in the ocean, people head for higher ground."
832,yo momma,self centered momma,"yo self centered momma is so fat, the world really does revolve around her!"
833,yo momma,big momma at the family reunion,"yo mama is so fat, your family photos have to be shot from a plane."
834,yo momma,"get a haircut, momma!","yo mama is so fat and lazy, that her hair do has been turned into a national forest."
835,yo momma,factory,"yo mama so stupid, she got fired at the m   m factory because she threw out all the w is!"
837,blond,lightbulb,"how many blondes does it take to screw in a lightbulb? none, blondes usually screw in cars!"
838,blond,what do railroad tracks...,what do railroad tracks and blondes have in common? they are both laid all over america!
839,blond,how do you get a blonde to laugh on friday?,how do you get a blonde to laugh on friday? tell her a joke on monday!
840,blond,blondesssss,what does a blonde do when she wakes up? she goes home!
841,blond,door knob,"a blonde is like a door knob, everyone gets a turn!"
842,knock-knock,little boy blue,knock knock! who is there? little boy blue. little boy blue who? micheal jackson!!!!!
843,other / misc,why are.....,why are constipated people so mean and rude? ..because they do not give a crap!
845,yo momma,old,"yo mama so old that when i told her to act her age, she died!"
851,gross,6.9,"a boy asks his dad, dad, what is 6.9?  the dad answers,  69 interrupted by a period! "
852,gross,santa,why does santa have such big balls? because he only comes once a year!
853,insults,you're so stupid you...,you are so stupid that you sold your car for gas money!
854,blond,bathroom,one blonde was so dumb she got locked in a bathroom and pissed her self!
855,blond,turtles,"a blonde is like a turtle. if either one is on their back, they are screwed!"
857,blond,TRUE,how many blonde jokes are there? one. the rest are all true stories.
858,blond,internet,what is the difference between a blonde and the internet? not everyone has been on the internet!
860,gross,how do you fit...,how do you fit 4 gay guys on a chair? turn it upside down!
861,gross,what do osama bin laden,what do osama bin laden and crabs have in common. they both irritate bush!
863,gross,midgets,what is grosser than gross? when a midget walks by and says your hair smells nice!
864,other / misc,pumpkin,what is the name for a bandaid on a pumpkin? a pumpkin patch!
865,insults,killing a bird,"you are so stupid, you tried to kill a bird by throwing it off a cliff."
866,animal,killing fish,your so stupid you tried to kill a fish by drowning it!
867,insults,solar powered,your so stupid you invented glow in the dark sun glasses!
868,insults,waterproof,you are so dumb you invented water proof tea bags!
869,insults,taxi,"you are so fat, when you went outside wearing a yellow dress everybody called  taxi "
870,insults,ugly,"you are so ugly, you can not even turn on a lightbulb!"
871,insults,behind back,you are so fat that everybody has to talk behind your back!
883,yo momma,boogers,"yo mama so fat, when she sat on a quarter, boogers came out of george washington is nose."
884,lawyer,name?,what did the lawyer name his daughter? answer  sue
889,blond,blonde driver,why did the blonde take a right into the ditch? her blinker was on.
892,blond,rainy day,how do you keep a blonde busy on a rainy day? tell her to touch the rainbow.
897,insults,you're so stupid........fax,you are so stupid that when you send a fax you put a stamp on it
900,men / women,battle of the sexes,nobody will ever win the battle of the sexes. there is too much fraternizing with the enemy.
904,yo momma,love...,"yo mama is so fat, she fell in love and broke it."
906,animal,bmws & porcupines,what is the difference between a bmw   a porcupine? a porcupine has pricks on the outside.
917,insults,you're so poor,you are so poor i went in your front door and came out the back.
918,children,after school snack,why did the boy eat his homework? because his teacher said it was a piece of cake
921,insults,be comfortable,why do not you slip into something comfortable. like a coma.
